MCQ,Choices,Correct
Who coined the term machine learning in 1959?,a: Donald Hebb | b: Tom M. Mitchell | c: Arthur Samuel | d: Walter Pitts,c
What was the name of the experimental 'learning machine' developed by Raytheon Company in the early 1960s?,a: Cyberspace | b: Cybernetics | c: Cybertron | d: Cybersecurity,c
Who proposed the early mathematical models of neural networks to come up with algorithms that mirror human thought processes?,a: Warren McCulloch | b: Tom M. Mitchell | c: Donald Hebb | d: Arthur Samuel,a
"According to Tom M. Mitchell, what is the definition of machine learning algorithms?",a: Learning from data with respect to some class of tasks | b: Learning from experience with respect to some class of tasks | c: Learning from textbooks with respect to some class of tasks | d: Learning from teachers with respect to some class of tasks,b
What are the two objectives of modern-day machine learning?,a: To create data models and predict future outcomes | b: To classify data based on models and make predictions for future outcomes | c: To analyze data patterns and predict future outcomes | d: To develop algorithms and classify data based on models,b
